{
  "source_id": "SRC_ARCHIVES_CHEONMACHONG_EXCAV_001",
  "claim_ids": [
    "CLM_SILLA_COSTUME_009"
  ],
  "title": "천마총 발굴 (국가기록원 주제해설)",
  "institution_or_author": "국가기록원 (문화재관리국 1973 발굴 기록)",
  "url_or_path": "https://www.archives.go.kr/next/newsearch/listSubjectDescription.do?id=005668&sitePage=",
  "verified_at": "2026-09-15",
  "verified_by": "Claude Code (Historical QA, D-052 research agent + review)",
  "excerpt_or_summary": "5세기 말~6세기 초 단곽식 돌무지덧널무덤. 출토 관모: 금제관모·은제관모·금동관·백화수피제 관모. 금제·은제 과대 함께 출토.",
  "confidence": "FACT",
  "uncertainty": "백화수피 관모 개별 치수·형태는 미기재. 1974 발굴보고서·2019 기록집 PDF 확인 필요.",
  "source_type": "GOVERNMENT",
  "rights_id": null,
  "notes": "복식 검증 리서치 (D-052, 2026-09-15). 미디어 재사용 권리는 별개."
}
